prim_db	prim_id	prim_alt	sec_db	sec_id	sec_alt	trim_left	trim_right	red_db	red_id	red_alt	E-value	gap	orient	count	total	adj_p-value	p-value
dreme.xml	GWTCA	DREME	meme.xml	3	MEME	0	0	.	.	.	1.68e-02	19	1	4	16	3.38e-09	3.05e-08
dreme.xml	GWTCA	DREME	meme.xml	3	MEME	0	0	.	.	.	1.68e-02	19	4	4	16	5.31e-08	4.78e-07
dreme.xml	GWTCA	DREME	meme.xml	3	MEME	0	0	.	.	.	1.68e-02	19	6	4	16	5.31e-08	4.78e-07
dreme.xml	GWTCA	DREME	meme.xml	3	MEME	0	0	.	.	.	1.68e-02	19	8	4	16	8.17e-07	7.35e-06
dreme.xml	GWTCA	DREME	prodoric	MX000143	GcvA	0	0	.	.	.	3.65e+00	41	1	3	20	6.22e-07	5.60e-06
dreme.xml	GWTCA	DREME	prodoric	MX000050	Hpr	1	0	.	.	.	4.39e+00	15	3	3	20	8.21e-07	7.39e-06
dreme.xml	GWTCA	DREME	prodoric	MX000008	GlpR	0	1	.	.	.	4.40e+00	20	3	4	64	8.30e-07	7.47e-06
dreme.xml	GWTCA	DREME	prodoric	MX000200	MelR	0	0	.	.	.	5.11e+00	8	1	3	21	9.57e-07	8.61e-06
dreme.xml	GWTCA	DREME	prodoric	MX000200	MelR	0	0	.	.	.	5.11e+00	119	1	3	21	9.57e-07	8.61e-06
dreme.xml	GWTCA	DREME	prodoric	MX000204	murR	0	0	.	.	.	6.86e+00	26	3	5	162	1.18e-06	1.06e-05
dreme.xml	GWTCA	DREME	prodoric	MX000204	murR	0	0	.	.	.	6.86e+00	26	8	8	162	2.19e-06	1.97e-05
dreme.xml	GWTCA	DREME	prodoric	MX000204	murR	0	0	.	.	.	6.86e+00	26	7	6	162	2.70e-06	2.43e-05
dreme.xml	GWTCA	DREME	prodoric	MX000134	IciA	0	1	.	.	.	8.72e+00	58	7	6	142	1.56e-06	1.40e-05
##
# Detailed descriptions of columns in this file:
#
# prim_db:	The name of the database (file name) that contains the primary motif.
# prim_id:	A name for the primary motif that is unique in the motif database file.
# prim_alt:	An alternate name of the primary motif that may be provided
#		in the motif database file.
# sec_db:	The name of the database (file name) that contains the secondary motif.
# sec_id:	A name for the motif that is unique in the motif database file.
# sec_alt:	An alternate name of the secondary motif that may be provided
#		in the motif database file.
# trim_left:	Number of positions trimmed from left of secondary motif
# trim_right:	Number of positions trimmed from right of secondary motif
# If the next three fields are not blank, the motif is redundant with a more significant ('parent') motif.
# red_db:	The database (file name) that contains the parent motif.
# red_id:	A name for the parent motif that is unique in the motif database file.
# red_alt:	An alternate name of the parent motif that may be provided
#		in the motif database file.
# E-value:	The expected number motifs that would have least one
#		spacing as enriched as the best spacing for this secondary.
#		The E-value is the best spacing p-value multiplied by the number of motifs in the
#		input database(s).
# gap:		The distance between the edge of the primary and the (trimmed) secondary motif.
# orient:	The (combination) of quadrants for which occurrences
#		of this spacing are combined.
# count:	The number of occurrences of the secondary motif with the
#		given spacing and orientation to the primary motif.
# total:	The total number of occurrences of the secondary motif within the
#		margins around the best primary motif occurrence.
# adj_p-value:	The p-value of the gap and orientation, adjusted for
#		nine combinations of quadrants times the number of gaps tested
#		(as controlled by the -range switch).
# p-value:	The p-value of the gap and orientation adjusted only for the number of gaps tested.
